document,summary,original_length,summary_length
faq_daftar_udinus,"daftar di Udi dapat dilakuka gah, Kota Semara Kota, Kota Kediri, Jawa Timur 64129 us Lombok
Pe g melalui situs pjj",653,114
faq_keuangan,"Remidi

JAWABAN:
Tata Cara Pembayara Virtual Accou omor Virtual Accou kode khusus remidi, yaitu 03 toh:
NIM: A11 sesuai format ba Nama mahasiswa da Nama mahasiswa da omor VA sesuai format (misal Nama mahasiswa da omor VA sesuai format (misal Nama mahasiswa da omor VA khusus remidi ya",1497,284
faq_krs,"g KRS

Jawaba g memuat daftar mata kuliah ya KRS merupaka",327,57
faq_udinus_profil,ggi Swasta (PTS) ya al Nomor 196/D/O/2001,267,41
kurikulum_teknik_informatika,"SKS = takara 1 SKS pada proses pembelajara it / mgg / smt
    Pe gambil paket 20 SKS pada semester I da 21 SKS pada semester II ya, jumlah SKS sesuai I",607,151
profil_ekonomi&bisnis,Fakultas Eko fakultas ya,351,24
profil_fib,Fakultas Ilmu Budaya atau FIB merupaka,219,38
profil_fk,"Fakultas Kedoktera Berawal dari Sekolah Ti g waktu, Sekolah Ti jadi Fakultas Kesehata jadi Fakultas Kedoktera",566,109
profil_fkes,toro (UDINUS) melalui Fakultas Ilmu Kesehata program sebagai upaya pe sumber daya ma,299,84
profil_ilkom,"kapasitas wirausaha sebagai salah satu keistimewaa g harus dicapai fakultas Alhasil, fakultas ilmu komputer dia",378,111
profil_teknik,Fakultas Tek salah satu e,325,25
tatatertib_berkunjung_upt,bagi mahasiswa da sivitas akademika UDINUS tata tertib ya oleh mahasiswa da sivitas akademika UDINUS Berikut adalah tata tertib ketika berku mahasiswa da sivitas akademika ya taati tata tertib ya,836,195
